sentence,aspect,sentiment
"Звуки взрывов в космосе нарушали immersion",sound,negative
"Шорох шелка в сцене свидания добавлял интимности",sound,positive
"Фоновые голоса в кафе звучали как бессмысленный набор фраз",sound,negative
"Мотив путешествия в саундтреке пробуждал жажду приключений",sound,positive
"Звуки ударов мечей были лишены металлического тембра",sound,negative
"Атмосферный гул подземелья создавал ощущение claustrophobia",sound,positive
"Шум дождя на крыше был настолько громким, что мешал диалогам",sound,negative
"Мелодия в сцене воссоединения трогала до слез",sound,positive
"Звуки работы компьютера будущего напоминали старый модем",sound,negative
"Шепот волн на рассвете создавал ощущение умиротворения",sound,positive
"Музыка в сцене погони заглушала звуки окружения",sound,negative
"Лейтмотив злодея звучал как какофония, усиливая его хаос",sound,positive
"Звуки шагов по гравию не соответствовали его фракции",sound,negative
"Тонкий звук лопающихся пузырей добавлял сцене легкости",sound,positive
"Фоновый шум в баре звучал как зацикленный трек",sound,negative
"Мотив расставания в саундтреке был пронзительно грустным",sound,positive
"Звуки ударов в боксерском поединке были приглушенными",sound,negative
"Шорох пергамента в тишине добавлял исторической достоверности",sound,positive
"Эффект эха в горах звучал искусственно",sound,negative
"Мелодия в сцене полета вызывала ощущение свободы",sound,positive
"Звуки работы механизмов корабля были монотонными",sound,negative
"Шепот звездного ветра в космосе создавал mystical атмосферу",sound,positive
"Музыка в финальной битве заглушала важные реплики",sound,negative
"Лейтмотив дома звучал как объятие после долгой разлуки",sound,positive
"Звуки падающих капель в пещере были неестественно ритмичными",sound,negative
"Тонкий звон монет добавлял сцене исторической точности",sound,positive
"Шум толпы на стадионе звучал как однообразный гул",sound,negative
"Мотив путешествия в саундтреке пробуждал nostalgia",sound,positive
"Звуки бьющегося стекла были настолько резкими, что резали слух",sound,negative
"Шорох крыльев бабочки подчеркивал хрупкость момента",sound,positive
"Фоновые голоса в ресторане звучали как белый шум",sound,negative
"Мелодия в сцене прощания оставляла bittersweet послевкусие",sound,positive
"Звуки шагов по льду не передавали его хрупкость",sound,negative
"Атмосферный гул древнего леса создавал mystical атмосферу",sound,positive
"Шум дождя в сцене драмы был настолько громким, что отвлекал",sound,negative
"Мотив надежды в саундтреке звучал как луч света в темноте",sound,positive
"Звуки работы футуристичного компьютера напоминали писк старой техники",sound,negative
"Шепот призраков в замке добавлял сцене мистичности",sound,positive
"Музыка в сцене битвы заглушала звуки оружия",sound,negative
"Лейтмотив любви звучал как heartbeat главных героев",sound,positive
"Звуки ударов в драке не соответствовали хореографии",sound,negative
"Тонкий звук перелистываемых страниц добавлял warmth",sound,positive
"Эхо в горах звучало как дешевый эффект",sound,negative
"Мелодия в сцене восхождения на гору вдохновляла",sound,positive
"Звуки работы механизмов в научной лаборатории были шаблонными",sound,negative
"Шепот ветра в поле создавал ощущение бесконечности",sound,positive
"Музыка в финальной сцене резко обрывалась, оставляя недоумение",sound,negative
"Лейтмотив победы звучал как триумф всего фильма",sound,positive
"Звуки падающих листьев не соответствовали их количеству",sound,negative
"Тонкий звон колоколов вдали добавлял сцене глубины",sound,positive
"Шум города в утренних сценах звучал как зацикленный трек",sound,negative
"Мотив детства в саундтреке пробуждал теплые воспоминания",sound,positive
"Звуки бьющейся посуды были неестественно громкими",sound,negative
"Шорох песка под ногами добавлял сцене тактильности",sound,positive
"Фоновые голоса на рынке звучали как бессвязный шум",sound,negative
"Мелодия в сцене первого поцелуя была волшебной",sound,positive
"Звуки шагов по мрамору не передавали его холодность",sound,negative
"Атмосферный гул океана создавал медитативное настроение",sound,positive
"Шум дождя в сцене разлуки был настолько громким, что мешал",sound,negative
"Мотив путешествия в саундтреке звучал как гимн свободе",sound,positive
"Звуки работы футуристичных устройств напоминали старые приборы",sound,negative
"Шепот теней в коридоре добавлял suspense",sound,positive
"Музыка в сцене погони полностью заглушала диалоги",sound,negative
"Лейтмотив семьи звучал как самое важное в жизни",sound,positive
"Звуки ударов в тренировочной сцене были приглушенными",sound,negative
"Тонкий звук закипающего чайника добавлял уюта",sound,positive
"Эхо в соборе звучало искусственно",sound,negative
"Мелодия в сцене воссоединения семьи трогала до глубины души",sound,positive
"Звуки шагов по траве не соответствовали ее густоте",sound,negative
"Шепот звезд в космосе создавал ощущение бесконечности",sound,positive
"Музыка в финале резко обрывалась, оставляя разочарование",sound,negative
"Лейтмотив дружбы звучал как обещание верности",sound,positive
"Звуки падающих капель в пещере были неестественно громкими",sound,negative
"Тонкий звон бокалов добавлял сцене праздничности",sound,positive
"Шум ветра в горах звучал как зацикленный эффект",sound,negative
"Мотив надежды в саундтреке звучал как свет в конце тоннеля",sound,positive
"Звуки работы механизмов в цеху были монотонными",sound,negative
"Шорох снега под ногами добавлял сцене winter magic",sound,positive
"Фоновые голоса в аэропорту звучали как бессмысленный шум",sound,negative
"Мелодия в сцене последнего танца была heartbreaking",sound,positive
"Звуки шагов по ковру не соответствовали его толщине",sound,negative
"Атмосферный гул джунглей создавал immersive эффект",sound,positive
"Шум дождя в сцене признания был настолько громким, что мешал",sound,negative
"Мотив путешествия в саундтреке звучал как call to adventure",sound,positive
"Звуки футуристичного транспорта напоминали старые автомобили",sound,negative
"Шепот ночных насекомых добавлял realism ночной сцене",sound,positive
"Музыка в сцене битвы полностью заглушала окружение",sound,negative
"Лейтмотив любви звучал как самое важное в мире",sound,positive
"Звуки ударов в тренировочной сцене не передавали силу",sound,negative
"Тонкий звук заводимых часов добавлял suspense",sound,positive
"Эхо в замке звучало как дешевый эффект",sound,negative
"Мелодия в сцене прощания оставляла щемящее чувство",sound,positive
"Звуки шагов по пеплу не соответствовали его текстуре",sound,negative
"Шепот прибоя создавал meditative настроение",sound,positive
"Музыка в финале резко обрывалась, оставляя пустоту",sound,negative