sentence,aspect,sentiment
"Операторская работа в фильме просто восхитительна",picture,positive
"Кадры выглядели плоскими и безжизненными",picture,negative
"Визуальный ряд завораживал с первой минуты",picture,positive
"Спецэффекты выглядели дешево и ненатурально",picture,negative
"Картинка фильма - настоящее пиршество для глаз",picture,positive
"Съемка в темных сценах была просто ужасной",picture,negative
"Каждый кадр можно было повесить в рамку как произведение искусства",picture,positive
"Зеленый экран в некоторых сценах бросался в глаза",picture,negative
"Визуальные эффекты были настолько реалистичны, что их не отличить от реальности",picture,positive
"Оператор явно не справился с динамичными сценами",picture,negative
"Цветовая гамма фильма создавала уникальную атмосферу",picture,positive
"Компьютерная графика выглядела как из игры 2000-х",picture,negative
"Работа оператора заслуживает отдельной награды",picture,positive
"Сцены ночных съемок получились зернистыми и нечеткими",picture,negative
"Визуальная эстетика фильма - его главное достоинство",picture,positive
"Спецэффекты портили впечатление от хорошей актерской игры",picture,negative
"Камера двигалась так плавно, будто парила в воздухе",picture,positive
"Свет в интерьерных сценах был поставлен ужасно",picture,negative
"Визуальные метафоры в кадре добавляли глубины сюжету",picture,positive
"CGI-персонажи выглядели неестественно и отвлекали",picture,negative
"Оператор использовал необычные ракурсы, которые усиливали драматизм",picture,positive
"Дрожащая камера в спокойных сценах раздражала",picture,negative
"Цветокоррекция создавала уникальное настроение каждой сцены",picture,positive
"Взрывы и огонь выглядели как из дешевого мультфильма",picture,negative
"Съемка пейзажей была на уровне National Geographic",picture,positive
"Некоторые кадры были переэкспонированы до белизны",picture,negative
"Визуальный стиль фильма запомнится надолго",picture,positive
"Компьютерные эффекты старели на глазах",picture,negative
"Операторская работа передавала эмоции лучше слов",picture,positive
"Фокус в важных сценах был сбит",picture,negative
"Игра света и тени создавала потрясающие визуальные эффекты",picture,positive
"3D-модели выглядели пластиковыми и ненастоящими",picture,negative
"Каждый кадр был тщательно продуман и композиционно выверен",picture,positive
"Съемка action-сцен была хаотичной и непонятной",picture,negative
"Визуальное решение фильма было новаторским",picture,positive
"Спецэффекты явно не дотягивали до заявленного бюджета",picture,negative
"Оператор умело использовал естественное освещение",picture,positive
"Некоторые сцены были настолько темными, что ничего не было видно",picture,negative
"Цветовая палитра фильма создавала особую атмосферу",picture,positive
"CGI-персонажи не вписывались в реальные декорации",picture,negative
"Движение камеры идеально соответствовало настроению сцены",picture,positive
"Зернистость изображения была настолько сильной, что мешала просмотру",picture,negative
"Визуальные аллюзии к классической живописи восхищали",picture,positive
"Зеленый экран в сценах с хромакеем был слишком заметен",picture,negative
"Оператор создал уникальный визуальный почерк для фильма",picture,positive
"Баланс белого прыгал от сцены к сцене",picture,negative
"Картинка была настолько четкой, что казалось, будто смотришь в окно",picture,positive
"Компьютерная графика портила впечатление от практических эффектов",picture,negative
"Съемка под водой была выполнена безупречно",picture,positive
"В некоторых кадрах было видно микрофон",picture,negative
"Визуальный стиль фильма был самобытным и узнаваемым",picture,positive
"Спецэффекты выглядели как любительская работа",picture,negative
"Операторская работа передавала внутреннее состояние героев",picture,positive
"Дрожание камеры в диалоговых сценах вызывало морскую болезнь",picture,negative
"Игра с глубиной резкости создавала потрясающие эффекты",picture,positive
"3D-графика конфликтовала с живыми актерами",picture,negative
"Композиция кадров была безупречной в каждой сцене",picture,positive
"Световые блики в ночных сценах были слишком агрессивными",picture,negative
"Визуальные решения усиливали эмоциональное воздействие",picture,positive
"Спецэффекты выглядели недоделанными и сырыми",picture,negative
"Оператор использовал естественные источники света гениально",picture,positive
"Некоторые сцены были настолько пересвечены, что терялись детали",picture,negative
"Цветовая гамма фильма менялась вместе с настроением героев",picture,positive
"Компьютерные эффекты в сценах с огнем выглядели фальшиво",picture,negative
"Съемка с высоты птичьего полета открывала потрясающие виды",picture,positive
"Фокус постоянно прыгал в важных диалоговых сценах",picture,negative
"Визуальные контрасты между сценами были продуманы до мелочей",picture,positive
"Зеленый экран в сценах погони был очевиден",picture,negative
"Операторская работа превратила обычные локации в произведения искусства",picture,positive
"Свет в интерьерах был настолько плоским, что убивал объем",picture,negative
"Картинка фильма была настолько реалистичной, что казалось, будто находишься внутри",picture,positive
"Спецэффекты в космических сценах разочаровали",picture,negative
"Использование длинных планов было оправдано и эффектно",picture,positive
"Движение камеры в экшен-сценах вызывало тошноту",picture,negative
"Визуальные метафоры добавляли слои смысла",picture,positive
"CGI-персонажи не вызывали никакого сопереживания",picture,negative
"Оператор умело играл с тенью и полутенью",picture,positive
"Некоторые кадры были настолько темными, что приходилось догадываться, что происходит",picture,negative
"Цветокоррекция создавала уникальную атмосферу для каждого акта",picture,positive
"Компьютерные эффекты старели еще до выхода фильма",picture,negative
"Съемка от первого лица была использована гениально",picture,positive
"В некоторых сценах было видно оборудование съемочной группы",picture,negative
"Визуальный стиль фильма переопределил жанр",picture,positive
"Спецэффекты выглядели как демо-версия",picture,negative
"Оператор создал уникальный визуальный язык для повествования",picture,positive
"Баланс белого менялся хаотично от сцены к сцене",picture,negative
"Картинка была настолько детализированной, что хотелось пересматривать",picture,positive
"3D-графика в сценах с водой выглядела неестественно",picture,negative
"Съемка slow motion была использована уместно и эффектно",picture,positive
"Дрожание камеры в спокойных сценах раздражало",picture,negative
"Визуальные аллюзии к классическому искусству восхищали",picture,positive
"Спецэффекты в сценах с разрушениями выглядели дешево",picture,negative
"Операторская работа передавала хрупкость моментов",picture,positive
"Свет в ночных сценах был настолько искусственным, что разрушал атмосферу",picture,negative
"Цветовая палитра фильма рассказывала отдельную историю",picture,positive
"Компьютерная графика в массовых сценах была очевидна",picture,negative
"Использование естественных источников света создавало потрясающую реалистичность",picture,positive
"Некоторые кадры были настолько пересвечены, что терялась важная информация",picture,negative
"Визуальные решения фильма стали новым словом в кино",picture,positive
"Спецэффекты в сценах с магией выглядели неправдоподобно",picture,negative
"Оператор умело использовал отражения в кадре",picture,positive
"Фокус в эмоциональных сценах был сбит",picture,negative
"Картинка фильма завораживала своей глубиной и детализацией",picture,positive
"Зеленый экран в сценах полетов был слишком заметен",picture,negative
"Съемка с закрытой диафрагмой создавала потрясающую глубину резкости",picture,positive
"Свет в интерьерных сценах был настолько плоским, что убивал объем",picture,negative
"Визуальные контрасты между локациями были продуманы до мелочей",picture,positive
"3D-модели фантастических существ выглядели пластиковыми",picture,negative
"Операторская работа превращала обычные предметы в произведения искусства",picture,positive
"Движение камеры в диалоговых сценах было хаотичным",picture,negative
"Цветокоррекция усилила эмоциональное воздействие каждой сцены",picture,positive
"Компьютерные эффекты в сценах с природой выглядели фальшиво",picture,negative
"Использование практических эффектов вместо CGI было приятным сюрпризом",picture,positive
"Съемка с рук в спокойных сценах выглядела неуместно",picture,negative
"Визуальные метафоры добавляли глубины повествованию",picture,positive
"Спецэффекты в сценах с технологиями будущего разочаровали",picture,negative
"Оператор создал уникальную цветовую сигнатуру для фильма",picture,positive
"Некоторые ночные сцены были настолько темными, что невозможно было разобрать детали",picture,negative
"Картинка фильма была настолько реалистичной, что стирала грань между кино и реальностью",picture,positive
"CGI-персонажи в массовке выглядели как клоны",picture,negative
"Съемка с высоты создавала эпическое ощущение масштаба",picture,positive
"Баланс белого менялся без логического обоснования",picture,negative
"Визуальный стиль фильма переосмыслил жанровые каноны",picture,positive
"Спецэффекты в сценах с катастрофами выглядели неестественно",picture,negative
"Операторская работа передавала течение времени через свет",picture,positive
"Дрожание камеры в важных сценах мешало восприятию",picture,negative
"Цветовая гамма фильма менялась вместе с характером главного героя",picture,positive
"Компьютерная графика в сценах с животными выглядела фальшиво",picture,negative
"Использование длинных планов без монтажа было впечатляющим",picture,positive
"Свет в сценах с огнем был настолько искусственным, что разрушал магию",picture,negative
"Визуальные аллюзии к историческим событиям добавляли глубины",picture,positive
"Спецэффекты в сценах с трансформациями выглядели недоделанными",picture,negative
"Оператор умело использовал естественные рамки в кадре",picture,positive
"Фокус в ключевых моментах был не на том объекте",picture,negative
"Картинка фильма была настолько детализированной, что открывала новые детали при повторном просмотре",picture,positive
"3D-графика в сценах с разрушениями выглядела как из видеоигры",picture,negative
"Съемка с низкого ракурса создавала ощущение монументальности",picture,positive
"Зернистость изображения в цифровом фильме выглядела искусственно",picture,negative
"Визуальные решения фильма стали эталоном для жанра",picture,positive
"Спецэффекты в сценах с невесомостью выглядели неправдоподобно",picture,negative
"Операторская работа превращала обычные жесты в поэзию",picture,positive
"Свет в сценах рассвета был настолько искусственным, что разрушал атмосферу",picture,negative
"Цветовая палитра фильма рассказывала свою собственную историю",picture,positive
"Компьютерная графика в сценах с толпой была очевидна",picture,negative
"Использование теней вместо прямого света создавало потрясающую атмосферу",picture,positive
"Некоторые кадры были настолько переэкспонированы, что терялись важные детали",picture,negative
"Визуальный стиль фильма переопределил границы возможного в кино",picture,positive
"Спецэффекты в сценах с магией выглядели как из дешевого сериала",picture,negative
"Оператор умело использовал естественные препятствия для создания рамки в кадре",picture,positive
"Движение камеры в экшен-сценах вызывало головокружение",picture,negative
"Картинка фильма завораживала своей реалистичностью и глубиной",picture,positive
"Зеленый экран в сценах с фантастическими локациями был слишком заметен",picture,negative
"Съемка с контролируемой глубиной резкости создавала потрясающие эффекты",picture,positive
"Свет в интерьерных сценах был настолько плоским, что убивал атмосферу",picture,negative
"Визуальные контрасты между эпохами были продуманы до мелочей",picture,positive
"3D-модели мифических существ выглядели неестественно",picture,negative
"Операторская работа превращала обычные моменты в шедевры визуального искусства",picture,positive
"Баланс белого прыгал без видимой причины",picture,negative
"Цветокоррекция усилила эмоциональное воздействие каждого момента",picture,positive
"Компьютерные эффекты в сценах с природными катастрофами выглядели фальшиво",picture,negative
"Использование практических эффектов вместо компьютерной графики было приятным сюрпризом",picture,positive
"Съемка с рук в важных сценах выглядела непрофессионально",picture,negative
"Визуальные метафоры добавляли глубины сюжету",picture,positive
"Спецэффекты в сценах с технологиями будущего разочаровали",picture,negative
"Оператор создал уникальную цветовую сигнатуру для каждого персонажа",picture,positive
"Некоторые ночные сцены были настолько темными, что терялся смысл происходящего",picture,negative
"Картинка фильма была настолько реалистичной, что казалось, будто наблюдаешь за реальными событиями",picture,positive
"CGI-персонажи в массовых сценах выглядели неестественно",picture,negative
"Съемка с высоты подчеркивала масштаб происходящего",picture,positive
"Баланс белого менялся без видимой логики между сценами",picture,negative
"Визуальный стиль фильма переосмыслил визуальные каноны жанра",picture,positive
"Каждый кадр был наполнен смыслом благодаря идеальной композиции",picture,positive
"Спецэффекты в сценах с дождем выглядели как дешевая анимация",picture,negative
"Оператор мастерски использовал естественные тени для создания настроения",picture,positive
"В некоторых сценах было видно, что актеры стоят перед зеленым экраном",picture,negative
"Цветопередача в фильме была настолько точной, что казалось, будто видишь мир глазами героя",picture,positive
"3D-модели зданий выглядели как из конструктора",picture,negative
"Съемка в движении придавала динамику даже самым спокойным сценам",picture,positive
"Свет в ночных эпизодах был настолько искусственным, что разрушал погружение",picture,negative
"Визуальные отсылки к классическому кинематографу добавляли глубины",picture,positive
"Компьютерные эффекты в сценах с водой выглядели неестественно",picture,negative
"Операторская работа превращала обычные диалоги в визуальные шедевры",picture,positive
"Фокус в ключевых моментах был расставлен неправильно",picture,negative
"Картинка фильма была настолько живой, что казалось, будто дышит",picture,positive
"Зеленый экран в сценах с горами был слишком очевиден",picture,negative
"Съемка с использованием зеркал создавала потрясающие визуальные иллюзии",picture,positive
"Свет в интерьерах был настолько плоским, что убивал объем",picture,negative
"Визуальные контрасты между реальностью и фантазией были идеальны",picture,positive
"CGI-животные выглядели как мультяшные персонажи",picture,negative
"Операторская работа передавала хрупкость каждого мгновения",picture,positive
"Движение камеры в экшен-сценах было хаотичным и раздражающим",picture,negative
"Цветовая гамма фильма менялась вместе с развитием сюжета",picture,positive
"Спецэффекты в сценах с ветром выглядели фальшиво",picture,negative
"Использование длинных планов создавало эффект присутствия",picture,positive
"Некоторые кадры были настолько темными, что невозможно было разобрать детали",picture,negative
"Визуальный стиль фильма переопределил жанровые стандарты",picture,positive
"Спецэффекты в сценах с магией выглядели как из дешевого мультфильма",picture,negative
"Оператор умело играл с бликами и отражениями",picture,positive
"Баланс белого менялся без логики от сцены к сцене",picture,negative
"Картинка была настолько детализированной, что хотелось останавливать каждый кадр",picture,positive
"3D-графика в сценах с огнем выглядела как из видеоигры",picture,negative
"Съемка slow motion использовалась уместно и добавляла драматизма",picture,positive
"Дрожание камеры в спокойных сценах выглядело неуместно",picture,negative
"Визуальные аллюзии к живописи Возрождения восхищали",picture,positive
