sentence,aspect,sentiment
"Спецэффекты в сценах с разрушениями выглядели недоделанными",picture,negative
"Операторская работа передавала внутренний мир героев через свет",picture,positive
"Свет в ночных сценах был настолько искусственным, что разрушал атмосферу",picture,negative
"Цветовая палитра фильма рассказывала отдельную историю",picture,positive
"Компьютерная графика в массовых сценах была слишком заметна",picture,negative
"Использование естественного света создавало потрясающую реалистичность",picture,positive
"Некоторые кадры были настолько пересвечены, что терялись важные детали",picture,negative
"Визуальные решения фильма стали новым эталоном для жанра",picture,positive
"Спецэффекты в сценах с невесомостью выглядели неправдоподобно",picture,negative
"Оператор умело использовал естественные рамки в кадре",picture,positive
"Фокус в эмоциональных сценах был расставлен неправильно",picture,negative
"Картинка фильма завораживала своей глубиной и детализацией",picture,positive
"Зеленый экран в сценах полетов был слишком очевиден",picture,negative
"Съемка с закрытой диафрагмой создавала потрясающую глубину резкости",picture,positive
"Свет в интерьерных сценах был настолько плоским, что убивал объем",picture,negative
"Визуальные контрасты между локациями были продуманы идеально",picture,positive
"3D-модели фантастических существ выглядели пластиковыми",picture,negative
"Операторская работа превращала обычные предметы в произведения искусства",picture,positive
"Движение камеры в диалоговых сценах было хаотичным",picture,negative
"Цветокоррекция усилила эмоциональное воздействие каждой сцены",picture,positive
"Компьютерные эффекты в сценах с природой выглядели фальшиво",picture,negative
"Использование практических эффектов вместо CGI было приятным сюрпризом",picture,positive
"Съемка с рук в спокойных сценах выглядела неуместно",picture,negative
"Визуальные метафоры добавляли глубины повествованию",picture,positive
"Спецэффекты в сценах с технологиями будущего разочаровали",picture,negative
"Оператор создал уникальную цветовую сигнатуру для фильма",picture,positive
"Некоторые ночные сцены были настолько темными, что невозможно было разобрать детали",picture,negative
"Картинка фильма была настолько реалистичной, что стирала грань между кино и реальностью",picture,positive
"CGI-персонажи в массовке выглядели как клоны",picture,negative
"Съемка с высоты создавала эпическое ощущение масштаба",picture,positive
"Баланс белого менялся без логического обоснования",picture,negative
"Визуальный стиль фильма переосмыслил жанровые каноны",picture,positive
"Спецэффекты в сценах с катастрофами выглядели неестественно",picture,negative
"Операторская работа передавала течение времени через свет",picture,positive
"Дрожание камеры в важных сценах мешало восприятию",picture,negative
"Цветовая гамма фильма менялась вместе с характером главного героя",picture,positive
"Компьютерная графика в сценах с животными выглядела фальшиво",picture,negative
"Использование длинных планов без монтажа было впечатляющим",picture,positive
"Свет в сценах с огнем был настолько искусственным, что разрушал магию",picture,negative
"Визуальные аллюзии к историческим событиям добавляли глубины",picture,positive
"Спецэффекты в сценах с трансформациями выглядели недоделанными",picture,negative
"Оператор умело использовал естественные рамки в кадре",picture,positive
"Фокус в ключевых моментах был не на том объекте",picture,negative
"Картинка фильма была настолько детализированной, что открывала новые детали при повторном просмотре",picture,positive
"3D-графика в сценах с разрушениями выглядела как из видеоигры",picture,negative
"Съемка с низкого ракурса создавала ощущение монументальности",picture,positive
"Зернистость изображения в цифровом фильме выглядела искусственно",picture,negative
"Визуальные решения фильма стали эталоном для жанра",picture,positive
"Спецэффекты в сценах с невесомостью выглядели неправдоподобно",picture,negative
"Операторская работа превращала обычные жесты в поэзию",picture,positive
"Свет в сценах рассвета был настолько искусственным, что разрушал атмосферу",picture,negative
"Цветовая палитра фильма рассказывала свою собственную историю",picture,positive
"Компьютерная графика в сценах с толпой была очевидна",picture,negative
"Использование теней вместо прямого света создавало потрясающую атмосферу",picture,positive
"Некоторые кадры были настолько переэкспонированы, что терялись важные детали",picture,negative
"Визуальный стиль фильма переопределил границы возможного в кино",picture,positive
"Спецэффекты в сценах с магией выглядели как из дешевого сериала",picture,negative
"Оператор умело использовал естественные препятствия для создания рамки в кадре",picture,positive
"Движение камеры в экшен-сценах вызывало головокружение",picture,negative
"Картинка фильма завораживала своей реалистичностью и глубиной",picture,positive
"Зеленый экран в сценах с фантастическими локациями был слишком заметен",picture,negative
"Съемка с контролируемой глубиной резкости создавала потрясающие эффекты",picture,positive
"Свет в интерьерных сценах был настолько плоским, что убивал атмосферу",picture,negative
"Визуальные контрасты между эпохами были продуманы до мелочей",picture,positive
"3D-модели мифических существ выглядели неестественно",picture,negative
"Операторская работа превращала обычные моменты в шедевры визуального искусства",picture,positive
"Баланс белого прыгал без видимой причины",picture,negative
"Цветокоррекция усилила эмоциональное воздействие каждого момента",picture,positive
"Компьютерные эффекты в сценах с природными катастрофами выглядели фальшиво",picture,negative
"Использование практических эффектов вместо компьютерной графики было приятным сюрпризом",picture,positive
"Съемка с рук в важных сценах выглядела непрофессионально",picture,negative
"Визуальные метафоры добавляли глубины сюжету",picture,positive
"Спецэффекты в сценах с технологиями будущего разочаровали",picture,negative
"Оператор создал уникальную цветовую сигнатуру для каждого персонажа",picture,positive
"Некоторые ночные сцены были настолько темными, что терялся смысл происходящего",picture,negative
"Картинка фильма была настолько реалистичной, что казалось, будто наблюдаешь за реальными событиями",picture,positive
"CGI-персонажи в массовых сценах выглядели неестественно",picture,negative
"Съемка с высоты подчеркивала масштаб происходящего",picture,positive
"Баланс белого менялся без видимой логики между сценами",picture,negative
"Визуальный стиль фильма переосмыслил визуальные каноны жанра",picture,positive
"Спецэффекты в сценах с дождем выглядели как дешевая анимация",picture,negative
"Оператор мастерски использовал естественные тени для создания настроения",picture,positive
"В некоторых сценах было видно, что актеры стоят перед зеленым экраном",picture,negative
"Цветопередача в фильме была настолько точной, что казалось, будто видишь мир глазами героя",picture,positive
"3D-модели зданий выглядели как из конструктора",picture,negative
"Съемка в движении придавала динамику даже самым спокойным сценам",picture,positive
"Свет в ночных эпизодах был настолько искусственным, что разрушал погружение",picture,negative
"Визуальные отсылки к классическому кинематографу добавляли глубины",picture,positive
"Компьютерные эффекты в сценах с водой выглядели неестественно",picture,negative
"Операторская работа превращала обычные диалоги в визуальные шедевры",picture,positive
"Фокус в ключевых моментах был расставлен неправильно",picture,negative
"Картинка фильма была настолько живой, что казалось, будто дышит",picture,positive
"Зеленый экран в сценах с горами был слишком очевиден",picture,negative
"Съемка с использованием зеркал создавала потрясающие визуальные иллюзии",picture,positive
"Свет в интерьерах был настолько плоским, что убивал объем",picture,negative
"Визуальные контрасты между реальностью и фантазией были идеальны",picture,positive
"CGI-животные выглядели как мультяшные персонажи",picture,negative
"Операторская работа передавала хрупкость каждого мгновения",picture,positive
"Движение камеры в экшен-сценах было хаотичным и раздражающим",picture,negative
"Цветовая гамма фильма менялась вместе с развитием сюжета",picture,positive
"Спецэффекты в сценах с ветром выглядели фальшиво",picture,negative
"Использование длинных планов создавало эффект присутствия",picture,positive
"Некоторые кадры были настолько темными, что невозможно было разобрать детали",picture,negative
"Визуальный стиль фильма переопределил жанровые стандарты",picture,positive
"Спецэффекты в сценах с магией выглядели как из дешевого мультфильма",picture,negative
"Оператор умело играл с бликами и отражениями",picture,positive
"Баланс белого менялся без логики от сцены к сцене",picture,negative
"Картинка была настолько детализированной, что хотелось останавливать каждый кадр",picture,positive
"3D-графика в сценах с огнем выглядела как из видеоигры",picture,negative
"Съемка slow motion использовалась уместно и добавляла драматизма",picture,positive
"Дрожание камеры в спокойных сценах выглядело неуместно",picture,negative
"Визуальные аллюзии к живописи Возрождения восхищали",picture,positive
"Спецэффекты в сценах с разрушениями выглядели недоделанными",picture,negative
"Операторская работа передавала внутренний мир героев через свет",picture,positive
"Свет в ночных сценах был настолько искусственным, что разрушал атмосферу",picture,negative
"Цветовая палитра фильма рассказывала отдельную историю",picture,positive
"Компьютерная графика в массовых сценах была слишком заметна",picture,negative
"Использование естественного света создавало потрясающую реалистичность",picture,positive
"Некоторые кадры были настолько пересвечены, что терялись важные детали",picture,negative
"Визуальные решения фильма стали новым эталоном для жанра",picture,positive
"Спецэффекты в сценах с невесомостью выглядели неправдоподобно",picture,negative
"Оператор умело использовал естественные рамки в кадре",picture,positive
"Фокус в эмоциональных сценах был расставлен неправильно",picture,negative
"Картинка фильма завораживала своей глубиной и детализацией",picture,positive
"Зеленый экран в сценах полетов был слишком очевиден",picture,negative
