sentence,aspect,sentiment
"Саундтрек идеально подчеркивал атмосферу фильма",sound,positive
"Звуковое сопровождение было настолько громким, что заглушало диалоги",sound,negative
"Музыкальная тема запомнилась надолго после просмотра",sound,positive
"Звуковые эффекты в экшен-сценах звучали искусственно",sound,negative
"Атмосферный саундскейп погружал в мир фильма",sound,positive
"Диалоги были плохо сведены с фоновой музыкой",sound,negative
"Оригинальный саундтрек стал отдельным произведением искусства",sound,positive
"Звук взрывов был настолько резким, что вызывал дискомфорт",sound,negative
"Тонкая работа со звуком добавляла глубины сценам",sound,positive
"Фоновый шум часто заглушал важные реплики",sound,negative
"Музыкальные темы идеально отражали эмоции персонажей",sound,positive
"Звуковые эффекты в фантастических сценах звучали фальшиво",sound,negative
"3D-звук создавал эффект полного погружения",sound,positive
"Несбалансированный звук между сценами раздражал",sound,negative
"Лейтмотивы персонажей были гениально продуманы",sound,positive
"Шумовые эффекты в тихих сценах были слишком навязчивы",sound,negative
"Работа звукорежиссера заслуживает отдельной похвалы",sound,positive
"Перепады громкости между сценами заставляли постоянно регулировать звук",sound,negative
"Фильмовая музыка вызывала мурашки в ключевых моментах",sound,positive
"Звук шагов не соответствовал поверхности, по которой шли персонажи",sound,negative
"Тонкие звуковые детали добавляли реализма",sound,positive
"Диалоги в наушниках звучали неестественно тихо",sound,negative
"Саундтрек усиливал эмоциональное воздействие сцен",sound,positive
"Фальшивые звуки животных отвлекали от происходящего",sound,negative
"Объемный звук создавал эффект присутствия",sound,positive
"Музыка иногда полностью заглушала важные реплики",sound,negative
"Музыкальные цитаты из классики были использованы гениально",sound,positive
"Звуки ударов и падений не соответствовали визуальному ряду",sound,negative
"Звуковой дизайн создавал уникальную атмосферу",sound,positive
"Неравномерная громкость в разных сценах раздражала",sound,negative
"Тема главного героя стала культовой среди фанатов",sound,positive
"Компьютерные звуковые эффекты звучали шаблонно",sound,negative
"Работа со звуковым пространством была безупречной",sound,positive
"Шипение и фоновые шумы мешали восприятию диалогов",sound,negative
"Оркестровая музыка придавала эпичность ключевым сценам",sound,positive
"Звуки технологий будущего звучали неправдоподобно",sound,negative
"Тонкие изменения в звуковом ландшафте сопровождали развитие сюжета",sound,positive
"Резкие перепады громкости между действием и диалогами утомляли",sound,negative
"Электронный саундтрек идеально соответствовал стилю фильма",sound,positive
"Звуки природы звучали как из дешевой библиотеки эффектов",sound,negative
"Звуковая перспектива менялась в зависимости от локации",sound,positive
"Несбалансированный звук между левым и правым каналом раздражал",sound,negative
"Музыкальная партитура отражала внутренний мир героев",sound,positive
"Звуки боев были настолько однообразными, что утомляли",sound,negative
"Тонкая работа с реверберацией создавала ощущение разных пространств",sound,positive
"Диалоги в массовых сценах было невозможно разобрать",sound,negative
"Саундтрек стал самостоятельным хитом",sound,positive
"Звуки транспорта не соответствовали визуальному ряду",sound,negative
"Использование тишины как звукового приема было гениальным",sound,positive
"Фоновая музыка в тихих сценах была слишком навязчива",sound,negative
"Музыкальные темы плавно трансформировались вместе с персонажами",sound,positive
"Звуки оружия звучали как из старых видеоигр",sound,negative
"Звуковой контраст между сценами усиливал драматизм",sound,positive
"Некачественная запись диалогов бросалась в глаза",sound,negative
"Главная музыкальная тема вызывала нужные эмоции в нужный момент",sound,positive
"Звуковые эффекты в фантастических сценах были слишком шаблонными",sound,negative
"Работа с направленностью звука создавала эффект присутствия",sound,positive
"Шипение и помехи в тихих сценах раздражали",sound,negative
"Саундтрек идеально сочетал электронику и живые инструменты",sound,positive
"Звуки шагов не соответствовали поверхности",sound,negative
"Тонкие звуковые детали добавляли реализма миру фильма",sound,positive
"Музыка часто заглушала важные звуковые подсказки",sound,negative
"Лейтмотивы персонажей были узнаваемы и эмоциональны",sound,positive
"Звуки животных звучали неестественно и повторялись",sound,negative
"Звуковой дизайн создавал уникальную акустическую подпись каждого места",sound,positive
"Неравномерная громкость между эпизодами раздражала",sound,negative
"Музыкальные цитаты добавляли слои смысла",sound,positive
"Звуки технологий звучали неправдоподобно",sound,negative
"Работа с пространственным звуком была на высшем уровне",sound,positive
"Диалоги в экшен-сценах было невозможно разобрать",sound,negative
"Саундтрек усиливал напряжение в ключевых моментах",sound,positive
"Звуки ударов не соответствовали визуальному воздействию",sound,negative
"Тонкие изменения в звуковой атмосфере сопровождали развитие персонажей",sound,positive
"Резкие перепады громкости между сценами утомляли",sound,negative
"Оркестровая аранжировка придавала глубину эмоциям",sound,positive
"Звуки природы звучали как стандартные библиотечные эффекты",sound,negative
"Звуковая перспектива менялась вместе с настроением сцены",sound,positive
"Несбалансированный звук между передними и задними каналами раздражал",sound,negative
"Музыкальная партитура отражала дух эпохи",sound,positive
"Звуки боев были однообразными и предсказуемыми",sound,negative
"Тонкая работа с акустикой разных помещений восхищала",sound,positive
"Шепот персонажей был настолько тихим, что приходилось увеличивать громкость",sound,negative
"Саундтрек стал неотъемлемой частью вселенной фильма",sound,positive
"Звуки транспорта не соответствовали времени действия",sound,negative
"Использование асимметрии в звуке создавало напряжение",sound,positive
"Фоновая музыка в драматических сценах была слишком громкой",sound,negative
"Музыкальные темы плавно развивались вместе с сюжетом",sound,positive
"Звуки оружия звучали неправдоподобно",sound,negative
"Звуковой контраст между локациями был продуман до мелочей",sound,positive
"Некачественная синхронизация звука с изображением бросалась в глаза",sound,negative
"Главная музыкальная тема моментально узнавалась",sound,positive
"Звуковые эффекты в фантастических сценах были неоригинальными",sound,negative
"Работа с направленным звуком создавала эффект присутствия",sound,positive
"Фоновые шумы в тихих сценах были слишком навязчивы",sound,negative
"Саундтрек идеально сочетал акустические и электронные элементы",sound,positive
"Звуки шагов не соответствовали весу персонажей",sound,negative
"Тонкие звуковые детали добавляли глубины миру фильма",sound,positive
"Музыка часто перекрывала важные звуковые эффекты",sound,negative
"Лейтмотивы персонажей усиливали их индивидуальность",sound,positive
"Звуки животных звучали как из дешевой звуковой библиотеки",sound,negative
"Звуковой дизайн создавал уникальную атмосферу для каждого места",sound,positive
"Неравномерная громкость между сезонами раздражала",sound,negative
"Музыкальные цитаты добавляли ностальгические нотки",sound,positive
"Звуки технологий будущего звучали неправдоподобно",sound,negative
"Работа с объемным звуком была безупречной",sound,positive
"Диалоги в батальных сценах было невозможно разобрать",sound,negative
"Саундтрек усиливал драматизм ключевых сцен",sound,positive
"Звуки ударов не соответствовали силе воздействия",sound,negative
"Тонкие изменения в звуковой палитре сопровождали сюжетные повороты",sound,positive
"Резкие перепады громкости между эпизодами утомляли",sound,negative
"Оркестровая музыка придавала эпичность кульминации",sound,positive
"Звуки природы звучали искусственно и повторялись",sound,negative
"Звуковая перспектива менялась вместе с эмоциональным накалом",sound,positive
"Несбалансированный звук между диалогами и музыкой раздражал",sound,negative
"Музыкальная партитура отражала культурный контекст",sound,positive
"Звуки боев были шаблонными и неоригинальными",sound,negative
"Тонкая работа с реверберацией в разных пространствах восхищала",sound,positive
"Шепот персонажей был практически неслышным",sound,negative
"Саундтрек стал визитной карточкой франшизы",sound,positive
"Звуки транспорта не соответствовали эпохе",sound,negative
"Использование тишины как драматического приема было гениальным",sound,positive
"Фоновая музыка в эмоциональных сценах была слишком навязчива",sound,negative
"Музыкальные темы эволюционировали вместе с персонажами",sound,positive
"Звуки оружия звучали как из старых фильмов",sound,negative
"Звуковой контраст между эпохами был продуман до мелочей",sound,positive
"Некачественная запись окружающих звуков бросалась в глаза",sound,negative
"Главная музыкальная тема вызывала нужные ассоциации",sound,positive
"Звуковые эффекты в фантастических сценах были неинтересными",sound,negative
"Работа с пространственным звуком создавала эффект погружения",sound,positive
"Фоновые шумы в важных сценах отвлекали",sound,negative
"Саундтрек идеально сочетал традиционные и современные элементы",sound,positive
"Звуки шагов не соответствовали характеру персонажей",sound,negative
"Тонкие звуковые детали добавляли реализма вселенной",sound,positive
"Музыка часто перекрывала важные диалоги",sound,negative
"Лейтмотивы персонажей были эмоционально заряженными",sound,positive
"Звуки животных звучали неестественно для своей среды обитания",sound,negative
"Звуковой дизайн создавал уникальную акустику для каждого мира",sound,positive
"Неравномерная громкость между фильмами франшизы раздражала",sound,negative
"Музыкальные цитаты добавляли глубину повествованию",sound,positive
"Звуки технологий звучали неправдоподобно для заявленного будущего",sound,negative
"Работа с направленностью звука была на высшем уровне",sound,positive
"Диалоги в сценах сражений было невозможно понять",sound,negative
"Саундтрек усиливал напряжение в поворотных моментах",sound,positive
"Звуки ударов не соответствовали визуальному воздействию",sound,negative
"Тонкие изменения в звуковой атмосфере отражали развитие сюжета",sound,positive
"Резкие перепады громкости между жанровыми сценами утомляли",sound,negative
"Оркестровая аранжировка подчеркивала важность моментов",sound,positive
"Звуки природы звучали как стандартные эффекты",sound,negative
"Звуковая перспектива менялась вместе с психологическим состоянием героев",sound,positive
"Несбалансированный звук между музыкой и эффектами раздражал",sound,negative
"Музыкальная партитура отражала географию действия",sound,positive
"Звуки боев были предсказуемыми и неоригинальными",sound,negative
"Тонкая работа с акустикой разных эпох восхищала",sound,positive
"Шепот персонажей был настолько тихим, что терялся в шумах",sound,negative
"Саундтрек стал неотъемлемой частью кинематографического опыта",sound,positive
"Звуки транспорта не соответствовали технологическому уровню вселенной",sound,negative
"Использование звуковой асимметрии создавало напряжение",sound,positive
"Фоновая музыка в ключевых сценах была слишком громкой",sound,negative
"Звуковая палитра фильма была невероятно богатой и детализированной",sound,positive
"Шум ветра в сценах на открытой местности звучал искусственно",sound,negative
"Музыка плавно перетекала из одной темы в другую, создавая целостность",sound,positive
"Звуки стекла бьющегося были настолько резкими, что резали слух",sound,negative
"Атмосферные звуки города оживляли каждую сцену",sound,positive
"Синтезаторные звуки в саундтреке звучали дешево и неуместно",sound,negative
"Лейтмотив злодея вызывал подсознательное напряжение",sound,positive
"Звуки шагов в пустыне не соответствовали рыхлому песку",sound,negative
"Объемный звук в сценах полета создавал ощущение невесомости",sound,positive
"Диалоги в сценах с дождем были заглушены шумом воды",sound,negative
"Музыкальная тема любовной линии была пронзительно красивой",sound,positive
"Звуки выстрелов в космосе нарушали законы физики",sound,negative
"Тонкие звуковые намёки предвосхищали повороты сюжета",sound,positive
"Фоновый гул в подземных сценах был монотонным и раздражал",sound,negative
"Саксофон в саундтреке добавлял ноты меланхолии",sound,positive
"Звуки мечей в бою напоминали удары по консервным банкам",sound,negative
"Акустика храма передавала ощущение священного пространства",sound,positive
"Шепот за кадром был настолько тихим, что терял смысл",sound,negative
"Звуки природы менялись в зависимости от времени суток в кадре",sound,positive
"Электронные биты в историческом фильме звучали неуместно",sound,negative
"Шорох листьев под ногами добавлял сцене реализма",sound,positive
"Звук захлопывающейся двери был настолько громким, что пугал",sound,negative
"Мелодия в финале оставляла ощущение светлой грусти",sound,positive
"Звуки взмахов крыльев дракона были неестественно тяжелыми",sound,negative
"Тиканье часов усилило напряжение в сцене ожидания",sound,positive
"Шум толпы в массовых сценах звучал как зацикленная запись",sound,negative
"Скрипка в саундтреке передавала хрупкость момента",sound,positive
"Звуки падающих предметов не соответствовали их весу",sound,negative
"Эхо в пещере создавало эффект глубины и тайны",sound,positive
"Музыка в финальных титрах резко обрывалась, оставляя ощущение незавершенности",sound,negative
"Шум прибоя идеально синхронизировался с ритмом сцены",sound,positive
"Звуки дыхания в напряженных моментах были неестественно громкими",sound,negative
"Аранжировка народных инструментов добавляла колорит",sound,positive
"Звук открывающейся двери повторялся без вариаций",sound,negative
"Шум дождя за окном создавал уютную атмосферу",sound,positive
"Музыка в сцене погони заглушала важные звуковые подсказки",sound,negative
"Тема путешествия в саундтреке вызывала чувство свободы",sound,positive
"Звуки ударов в драке не соответствовали движениям актеров",sound,negative
"Шорох страниц в библиотеке добавлял сцене достоверности",sound,positive
"Фоновый гул в космических сценах был монотонным",sound,negative
"Мотив одиночества в музыке проникал до глубины души",sound,positive
"Звуки шагов по снегу были неестественно хрустящими",sound,negative
"Переходы между музыкальными темами были незаметными и гармоничными",sound,positive
"Шум двигателя машины не соответствовал ее модели",sound,negative
"Звук капель воды усиливал меланхоличное настроение сцены",sound,positive
"Крик персонажа в тишине был настолько резким, что резал слух",sound,negative
"Акустика концертного зала передавала атмосферу живого выступления",sound,positive
"Звуки птиц в лесу звучали как запись из одного и того же набора",sound,negative
"Мелодия в сцене расставания была heartbreaking",sound,positive
"Шум битвы на заднем плане сливался в монотонный гул",sound,negative
"Звук волн в бухте создавал медитативное настроение",sound,positive
"Эффект внезапной тишины после взрыва был использован гениально",sound,positive
"Звуки работы механизмов не соответствовали их устройству",sound,negative
"Шепот листьев на ветру добавлял сцене поэтичности",sound,positive
"Музыка в финале резко обрывалась, оставляя ощущение неудовлетворенности",sound,negative
"Лейтмотив надежды в саундтреке вдохновлял",sound,positive
"Звуки падающих камней в пещере были неестественно громкими",sound,negative
"Тонкий звон колокольчика предвещал важное событие",sound,positive
"Шум города в ночных сценах звучал как однообразная петля",sound,negative
"Музыкальная тема семьи теплой волной накрывала зрителя",sound,positive
